Product Description	Price	Prime Status	Product URL	Stars	Number of Reviews
Schede Grafiche AMD per Radeon HD7670, 4GB GDDR5 Computer PC Gaming Video GPU Scheda Grafica, 128-Bit, Supporto DirectX 11 PCI Express X16 2.1 DVI, HDMI, VGA	51,	Non-Prime	https://www.amazon.it/sspa/click?ie=UTF8&spc=MTozNzQ2Nzc0NzI0Mzc0Njc3OjE2OTk1NDc3MjI6c3BfYXRmOjIwMDk1MTQ1NDkzMDk4OjowOjo&url=%2FGrafiche-Computer-Grafica-128-Bit-Supporto%2Fdp%2FB0BGM23YML%2Fref%3Dsr_1_1_sspa%3Fkeywords%3Dgpu%26qid%3D1699547722%26sr%3D8-1-spons%26sp_csd%3Dd2lkZ2V0TmFtZT1zcF9hdGY%26psc%3D1	3,1 su 5 stelle	21
Scheda Grafica per PC, Scheda Grafica da Gioco 8GB GDDR5 256bit 1284/7000MHz PCIE 3.0, Scheda Grafica GPU 1080P con Porta HDMI/DP/DVI, Raffreddamento a Doppia Ventola(RX-580)	145,	Prime	https://www.amazon.it/sspa/click?ie=UTF8&spc=MTozNzQ2Nzc0NzI0Mzc0Njc3OjE2OTk1NDc3MjI6c3BfYXRmOjIwMTE3NjI3MTg0MTk4OjowOjo&url=%2FScheda-Grafica-7000MHz-Raffreddamento-Ventola%2Fdp%2FB0BN8VHGR6%2Fref%3Dsr_1_2_sspa%3Fkeywords%3Dgpu%26qid%3D1699547722%26sr%3D8-2-spons%26sp_csd%3Dd2lkZ2V0TmFtZT1zcF9hdGY%26psc%3D1	2,9 su 5 stelle	4
Scheda Grafica RX 580, Scheda Grafica GDDR5 da 8 GB con GPU 1284 MHz, 60 Hz 4K, PCI Express 3.0, 2 Ventole di Raffreddamento, Scheda Grafica da Gioco per CAD 3D, CAM, Editing Video e Immagini	120,	Non-Prime	https://www.amazon.it/sspa/click?ie=UTF8&spc=MTozNzQ2Nzc0NzI0Mzc0Njc3OjE2OTk1NDc3MjI6c3BfYXRmOjMwMDAwNTcxNzQ4NDQzMjo6MDo6&url=%2FGrafica-Express-Ventole-Raffreddamento-Immagini%2Fdp%2FB0BHWXNCH4%2Fref%3Dsr_1_3_sspa%3Fkeywords%3Dgpu%26qid%3D1699547722%26sr%3D8-3-spons%26sp_csd%3Dd2lkZ2V0TmFtZT1zcF9hdGY%26psc%3D1	3,6 su 5 stelle	42
NVIDIA Tesla K10 Dual GPU PCIE Module 8 GB Scheda video	3.198,	Non-Prime	https://www.amazon.it/sspa/click?ie=UTF8&spc=MTozNzQ2Nzc0NzI0Mzc0Njc3OjE2OTk1NDc3MjI6c3BfYXRmOjIwMDgxMDQ5MDM1Mzk4OjowOjo&url=%2FNVIDIA-Tesla-Module-Scheda-video%2Fdp%2FB08CXMTB72%2Fref%3Dsr_1_4_sspa%3Fkeywords%3Dgpu%26qid%3D1699547722%26sr%3D8-4-spons%26sp_csd%3Dd2lkZ2V0TmFtZT1zcF9hdGY%26psc%3D1	3,3 su 5 stelle	2
ASUS DUAL NVIDIA GeForce RTX 4060 OC Edition Scheda Grafica, 8 GB GDDR6 128-bit 17 Gbps PCIE 4.0, GPU Tweak III, DUAL-RTX-4060-O8G	349,	Non-Prime	https://www.amazon.it/ASUS-GeForce-Grafica-128-bit-DUAL-RTX-4060-O8G/dp/B0C8JT7K1M/ref=sr_1_5?keywords=gpu&qid=1699547722&sr=8-5	4,5 su 5 stelle	53
Gigabyte NVIDIA GeForce RTX 3060 GAMING OC V2 Scheda grafica - 12GB GDDR6, 192-bit, PCI-E 4.0, 1837MHz Core Clock, RGB, 2x DP 1.4, 2 x HDMI 2.1, NVIDIA Ampere - GV-N3060GAMING OC-8GD	328,	Non-Prime	https://www.amazon.it/Gigabyte-GeForce-3060-GAMING-V2/dp/B096Y2TYKV/ref=sr_1_6?keywords=gpu&qid=1699547722&sr=8-6	4,7 su 5 stelle	1.140
MSI Radeon RX 6650 XT MECH 2X 8G OC Scheda Video - AMD RX 6650 XT, GPU 2447/2669 MHz, 8000 MB di Memoria DDR6, Velocità di Memoria 17500 MHz, Bus di Memoria 128bit	289,	Non-Prime	https://www.amazon.it/MSI-Radeon-6650-MECH-GDDR6/dp/B09YHXT12P/ref=sr_1_7?keywords=gpu&qid=1699547722&sr=8-7	4,6 su 5 stelle	2.047
Nuwo Scheda Grafica GT730 NVIDIA GeForce GT 730, 2 GB DDR3, 128 bit, 700MHz, Scheda Video GPU a Basso Profilo per PC Gaming, DVI, HDMI, VGA, PCI Express 2.0, Supporta DirectX 11, Bulk	49,	Prime	https://www.amazon.it/Nuwo-Grafica-GeForce-Profilo-Supporta/dp/B0C6MZ6QMQ/ref=ice_ac_b_dpb?keywords=gpu&qid=1699547722&sr=8-8	4,3 su 5 stelle	36
Gigabyte NVIDIA GeForce RTX 4060 GAMING OC Scheda grafica - 8GB GDDR6, 128-bit, PCI-E 4.0, 2550MHz Core Clock, 2x DP 1.4, 2x HDMI 2.1a, NVIDIA DLSS 3 - GV-N4060GAMING OC-8GD	367,	Prime	https://www.amazon.it/Gigabyte-NVIDIA-GeForce-GAMING-grafica/dp/B0C8ZS7N73/ref=sr_1_9?keywords=gpu&qid=1699547722&sr=8-9	4,6 su 5 stelle	23
ASUS Phoenix AMD Radeon RX 550 Scheda Grafica, 4GB GDDR5, PCIe 3.0, HDMI, DisplayPort, DVI-D, Resistenza Alla Polvere IPX5, Ventole con Doppio Cuscinetto a Sfera, Tecnologia Auto-Extreme, Nero	112,	Prime	https://www.amazon.it/ASUS-DisplayPort-Resistenza-Cuscinetto-Auto-Extreme/dp/B089WFBK4H/ref=sr_1_10?keywords=gpu&qid=1699547722&sr=8-10	4,6 su 5 stelle	241
Asus Dual NVIDIA GeForce RTX 3060 V2 OC Edition Scheda Grafica, 12GB GDDR6 192-bit 15 Gbps PCIE 4.0, GPU NVIDIA Ampere, DUAL-RTX3060-O12G-V2	346,	Prime	https://www.amazon.it/ASUS-GeForce-Grafica-192-bit-DUAL-RTX3060-O12G-V2/dp/B096658ZWP/ref=sr_1_11?keywords=gpu&qid=1699547722&sr=8-11	4,6 su 5 stelle	1.160
ASUS Dual AMD Radeon RX 6600 V2 Scheda Grafica, 8 GB GDDR6 128-bit 14 Gbps PCIE 4.0, GPU Tweak III, DUAL-RX6600-8G-V2	244,	Non-Prime	https://www.amazon.it/ASUS-Radeon-Grafica-128-bit-DUAL-RX6600-8G-V2/dp/B0BRYR7QPV/ref=sr_1_12?keywords=gpu&qid=1699547722&sr=8-12	4,5 su 5 stelle	35
MSI GeForce RTX 4060 GAMING X 8G Scheda Grafica - RTX 4060 GPU, 8GB GDDR6 (17Gbps/128-bit), PCIe 4.0 - TWIN FROZR 9 (2 x TORX Fan 5.0), RGB - HDMI 2.1, DisplayPort 1.4a	371,	Non-Prime	https://www.amazon.it/MSI-GeForce-GAMING-Scheda-Grafica/dp/B0C7WCKXB6/ref=sr_1_13?keywords=gpu&qid=1699547722&sr=8-13	4,7 su 5 stelle	230
ASUS NVIDIA GeForce GT 710 Scheda grafica PCIe 2.0, Memoria DDR3 2 GB, Raffreddamento Passivo, Auto-Extreme, GPU Tweak III, Grigio	51,	Non-Prime	https://www.amazon.it/ASUS-grafica-GeForce-profilo-silenzioso/dp/B0B7XRYLVT/ref=sr_1_14?keywords=gpu&qid=1699547722&sr=8-14	4,3 su 5 stelle	410
ASUS Dual NVIDIA GeForce RTX 3050 V2 OC Edition Scheda Grafica, 8 GB GDDR6 128-bit 14 Gbps PCIE 4.0, GPU Tweak III, DUAL-RTX3050-O8G-V2	257,	Prime	https://www.amazon.it/ASUS-GeForce-Grafica-128-bit-DUAL-RTX3050-O8G-V2/dp/B0BY6XKC5K/ref=sr_1_15?keywords=gpu&qid=1699547722&sr=8-15	4,4 su 5 stelle	4
Scheda grafica da gioco ZOTAC GEFORCE RTX 3060 Twin Edge da 12 GB GDDR6	318,	Prime	https://www.amazon.it/Scheda-grafica-gioco-ZOTAC-GEFORCE/dp/B08WRF18SC/ref=sr_1_16?keywords=gpu&qid=1699547722&sr=8-16	4,5 su 5 stelle	242
ASUS NVIDIA GeForce GT 730 PCIe 2.0, Memoria DDR3 2 GB, Design a Slot Singolo, Auto-Extreme, GPU Tweak II, Nero	79,	Prime	https://www.amazon.it/ASUS-GeForce-Carte-Graphique-Profil/dp/B0B6FT5V2B/ref=sr_1_17?keywords=gpu&qid=1699547722&sr=8-17	4,8 su 5 stelle	6
ASUS Dual NVIDIA GeForce RTX 4070 OC Edition Scheda Grafica, 12 GB GDDR6X 192-bit 21 Gbps PCIE 4.0, GPU Tweak III, DUAL-RTX4070-O12G-WHITE	693,	Non-Prime	https://www.amazon.it/ASUS-GeForce-Grafica-192-bit-DUAL-RTX4070-O12G-WHITE/dp/B0C1T4NSFB/ref=sr_1_18?keywords=gpu&qid=1699547722&sr=8-18	4,7 su 5 stelle	30
ASUS TUF Gaming AMD Radeon RX 6500 XT OC Edition Scheda Grafica, AMD RDNA 2, PCIe 4.0, 4GB GDDR6, HDMI 2.1, DisplayPort 1.4a, Ventole Axial Tech e Doppi Cuscinetti a Sfera, GPU Tweak II, Nero	179,	Prime	https://www.amazon.it/ASUS-Grafica-DisplayPort-Ventole-Cuscinetti/dp/B09PRRQ3QC/ref=sr_1_19?keywords=gpu&qid=1699547722&sr=8-19	4,1 su 5 stelle	76
maxsun Scheda Video GEFORCE GT 710 1GB Scheda grafica a basso profilo Ready GPU DirectX 12, VGA, DVI-D, HDMI, Sistema di raffreddamento passiva silenziosa con raffreddamento passivo 0 dB efficiente	59,	Prime	https://www.amazon.it/MAXSUN-GT-710-raffreddamento-silenzioso/dp/B08Y5S5P55/ref=sr_1_20?keywords=gpu&qid=1699547722&sr=8-20	4,4 su 5 stelle	342
MUTOUHE Supporto per scheda grafica, supporto GPU in alluminio per schede grafiche regolabili per una vasta gamma di computer e schede grafiche (nero)	5,	Non-Prime	https://www.amazon.it/MUTOUHE-Supporto-supporto-alluminio-regolabili/dp/B0C5Q3BL3X/ref=sr_1_21?keywords=gpu&qid=1699547722&sr=8-21	5,0 su 5 stelle	3
MSI GeForce RTX 4070 VENTUS 2X 12G OC, Scheda Video Gaming -Memoria 12GB GDDR6X (21 Gbps/192-bit), PCI Express® Gen 4, DisplayPort x 3 (v1.4a), Boost clock 2505 MHz,TORX Fan 4.0, HDMI 2.1a	666,	Non-Prime	https://www.amazon.it/gp/bestsellers/pc/460090031/ref=sr_bs_21_460090031_1	4,6 su 5 stelle	463
ASUS DUAL AMD Radeon RX 7600 V2 OC Edition Scheda Grafica, 8 GB GDDR6 128-bit 18 Gbps PCIE 4.0, GPU Tweak III, DUAL-RX7600-O8G-V2	315,	Prime	https://www.amazon.it/ASUS-Radeon-Grafica-128-bit-DUAL-RX7600-O8G-V2/dp/B0C6B3147Z/ref=sr_1_23?keywords=gpu&qid=1699547722&sr=8-23	5,0 su 5 stelle	4
adspow Supporto Scheda Grafica GPU, Supporto Scheda Video, Supporto in Alluminio per Scheda Video Nero Supporto GPU Altezza Regolabile, Mini (27-50 mm)	6,	Non-Prime	https://www.amazon.it/adspow-Supporto-Grafica-Alluminio-Regolabile/dp/B0BX9H2G12/ref=sr_1_24?keywords=gpu&qid=1699547722&sr=8-24	4,7 su 5 stelle	145
Scheda Grafica RX 580, Scheda Grafica GDDR5 da 8 GB 256 Bit con GPU 1284 MHz, 60 Hz 4K, PCI Express 3.0, 2 Ventole di Raffreddamento, Interfaccia DP HDMI DVI D	140,	Prime	https://www.amazon.it/Grafica-Express-Ventole-Raffreddamento-Interfaccia/dp/B0B8Q724XQ/ref=sr_1_25?keywords=gpu&qid=1699547722&sr=8-25	3,7 su 5 stelle	56
MSI GeForce RTX™ 4060 Ti VENTUS 3X 8G OC, Scheda Video Gaming - Memoria 8GB GDDR6 ( 18Gbps/128-bit), PCI Express® Gen 4 x 16, DisplayPort x 3 (v1.4a), Torx Fan 4.0, HDMI 2.1a, Zero Frozr	473,	Non-Prime	https://www.amazon.it/MSI-GeForce-VENTUS-Scheda-Gaming/dp/B0C4F9HCF6/ref=sr_1_26?keywords=gpu&qid=1699547722&sr=8-26	4,4 su 5 stelle	125
ASUS Dual NVIDIA GeForce RTX 3050 OC Edition Scheda Grafica, 8GB GDDR6, PCIe 4.0, HDMI 2.1, DisplayPort 1.4a, Due Ventole Axial-Tech, PSU Consigliata 550W, GPU Tweak II, Tecnologia 0dB, LHR	317,	Non-Prime	https://www.amazon.it/GeForce-DisplayPort-Axial-Tech-Consigliata-Tecnologia/dp/B09QMG6FZX/ref=sr_1_27?keywords=gpu&qid=1699547722&sr=8-27	4,5 su 5 stelle	526
ASUS NVIDIA GeForce GT 730, Scheda Grafica, 2GB GDDR5, PCIe 2.0, HDMI, DVI, D-Sub, Supporta Fino a 3 Monitor, Design a due Slot, Ridotto Consumo Energetico, GPU Tweak II, Blu/Nero	80,	Prime	https://www.amazon.it/GeForce-Grafica-Supporta-Monitor-Energetico/dp/B01A9GJ55K/ref=sr_1_28?keywords=gpu&qid=1699547722&sr=8-28	4,4 su 5 stelle	810
maxsun AMD Radeon RX 580 8GB 2048SP GDDR5 Computer Video Scheda Grafica GPU per PC Gaming 256-Bit DirectX 12 DVI, HDMI, DisplayPort Multi Monitor Extend (nero)	132,	Non-Prime	https://www.amazon.it/maxsun-RX-580-2048SP-DisplayPort/dp/B0BY1GHRDV/ref=sr_1_29?keywords=gpu&qid=1699547722&sr=8-29	4,2 su 5 stelle	95
XFX VGA RADEON RX 6600 SPEEDSTER SWFT 210 8GB GDDR6	219,	Non-Prime	https://www.amazon.it/XFX-SPEEDSTER-RADEON-grafica-RX-66XL8LFDQ/dp/B09HHLX543/ref=sr_1_30?keywords=gpu&qid=1699547722&sr=8-30	4,6 su 5 stelle	2.519
Nuwo Scheda Video RX580 AMD RADEON RX 580 2048SP, 8 GB GDDR5, 256 bit, 1284MHz, Scheda Grafica GPU per PC Gaming, DVI, HDMI, DisplayPort, PCI Express 3.0 x16, Supporta DirectX 12, Bulk	N/A	Non-Prime	https://www.amazon.it/Nuwo-1284MHz-Grafica-DisplayPort-Supporta/dp/B0CDQ78HWC/ref=sr_1_31?keywords=gpu&qid=1699547722&sr=8-31	3,9 su 5 stelle	15
XFX SPEEDSTER QICK319 RADEON RX 6750XT CORE Gaming Scheda Grafica con 12GB GDDR6 HDMI 3xDP, AMD RDNA™ 2 (RX-675XYJFDP)	379,	Non-Prime	https://www.amazon.it/XFX-SPEEDSTER-QICK319-Grafica-RX-675XYJFDP/dp/B0B34M1YLW/ref=sr_1_32?keywords=gpu&qid=1699547722&sr=8-32	4,6 su 5 stelle	660
Gintai Cavo di alimentazione 10 Pin a 8 + 8 Pin per HP DL380 G9 e GPU 50 cm	25,	Non-Prime	https://www.amazon.it/sspa/click?ie=UTF8&spc=MTozNzQ2Nzc0NzI0Mzc0Njc3OjE2OTk1NDc3MjI6c3BfbXRmOjMwMDAyNzQ0NDkyNzczMjo6MDo6&url=%2FGintai-Cavo-alimentazione-Pin-DL380%2Fdp%2FB08725PCJZ%2Fref%3Dsr_1_33_sspa%3Fkeywords%3Dgpu%26qid%3D1699547722%26sr%3D8-33-spons%26sp_csd%3Dd2lkZ2V0TmFtZT1zcF9tdGY%26psc%3D1	N/A	N/A
RX580 8GB GDDR5 Scheda Grafica da Gioco a 256 Bit, Risoluzione 4096x2160 8 Pin Computer PC Gaming Video Scheda Grafica GPU con Doppia Ventola di RaffreddamentoPCI 3.0	150,	Non-Prime	https://www.amazon.it/sspa/click?ie=UTF8&spc=MTozNzQ2Nzc0NzI0Mzc0Njc3OjE2OTk1NDc3MjI6c3BfbXRmOjMwMDAwNTM3NTUwMTIzMjo6MDo6&url=%2FGrafica-Risoluzione-4096x2160-Computer-RaffreddamentoPCI%2Fdp%2FB0BV6KYKKN%2Fref%3Dsr_1_34_sspa%3Fkeywords%3Dgpu%26qid%3D1699547722%26sr%3D8-34-spons%26sp_csd%3Dd2lkZ2V0TmFtZT1zcF9tdGY%26psc%3D1	5,0 su 5 stelle	1
Iunipusy per scheda grafica GPU, 50 cm, di alimentazione GPU, 10 x 6 pin, PCIE fino a 8 pin (6 + 2), di alimentazione per alimentatore modulare, scheda grafica	11,	Non-Prime	https://www.amazon.it/sspa/click?ie=UTF8&spc=MTozNzQ2Nzc0NzI0Mzc0Njc3OjE2OTk1NDc3MjI6c3BfbXRmOjMwMDA3MDYwNjQ0MjIzMjo6MDo6&url=%2FIunipusy-grafica-alimentazione-alimentatore-modulare%2Fdp%2FB0BP7GHDV4%2Fref%3Dsr_1_35_sspa%3Fkeywords%3Dgpu%26qid%3D1699547722%26sr%3D8-35-spons%26sp_csd%3Dd2lkZ2V0TmFtZT1zcF9tdGY%26psc%3D1	N/A	Disponibilità: solo 6
One Enjoy Supporto per scheda grafica GPU, supporto per scheda video, supporto GPU (L)	10,	Non-Prime	https://www.amazon.it/sspa/click?ie=UTF8&spc=MTozNzQ2Nzc0NzI0Mzc0Njc3OjE2OTk1NDc3MjI6c3BfbXRmOjIwMDI2NTMwOTI2Mzk4OjowOjo&url=%2FSupporto-Scheda-Grafica-Video-GPU%2Fdp%2FB09FPJL1KY%2Fref%3Dsr_1_36_sspa%3Fkeywords%3Dgpu%26qid%3D1699547722%26sr%3D8-36-spons%26sp_csd%3Dd2lkZ2V0TmFtZT1zcF9tdGY%26psc%3D1	4,5 su 5 stelle	3.876
ASUS ROG Strix AMD Radeon RX 6650 XT V2 OC Edition Scheda Grafica, 8 GB GDDR6 128-bit 17,5 Gbps PCIE 4.0, GPU Tweak III, ROG-STRIX-RX6650XT-O8G-V2-GAMING	283,	Non-Prime	https://www.amazon.it/ASUS-Radeon-Grafica-128-bit-ROG-STRIX-RX6650XT-O8G-V2-GAMING/dp/B0BSH7B4LY/ref=sr_1_37?keywords=gpu&qid=1699547722&sr=8-37	4,3 su 5 stelle	154
ASUS Dual NVIDIA GeForce RTX 4070 OC Edition Scheda Grafica, 12 GB GDDR6X 192-bit 21 Gbps PCIE 4.0, GPU Tweak III, DUAL-RTX4070-O12G	669,	Non-Prime	https://www.amazon.it/ASUS-GeForce-Grafica-192-bit-DUAL-RTX4070-O12G/dp/B0BY2KSKL9/ref=sr_1_38?keywords=gpu&qid=1699547722&sr=8-38	4,4 su 5 stelle	63
CERRXIAN 1FT ATX3.0 12VHPWR a 3x 8Pin Cavo di alimentazione,PCI-e 5.0 12VHPWR ATX3.0 600W 16 Pin Maschio a 3x8Pin(6+2) Femmina Cavo, per Scheda GPU 12+4pin RTX 3090Ti 4070Ti 4080 4090 (2x8Pin M-0.7M)	22,	Non-Prime	https://www.amazon.it/CERRXIAN-12VHPWR-alimentazione-Maschio-Femmina/dp/B0CGRPM8RD/ref=sr_1_39?keywords=gpu&qid=1699547722&sr=8-39	5,0 su 5 stelle	1
NIZEAMI GT210 1GB Schede Grafiche Scheda Video Un 64 Bit per GPU Giochi per PC -I Compatibile VGA Scheda Grafica Un Doppio Schermo Utilizzata	N/A	Non-Prime	https://www.amazon.it/NIZEAMI-Grafiche-Compatibile-Grafica-Utilizzata/dp/B0B9RL9CMS/ref=sr_1_40?keywords=gpu&qid=1699547722&sr=8-40	4,5 su 5 stelle	2
ASUS TUF Gaming NVIDIA GeForice RTX 3070 V2 OC Edition Scheda Grafica, 8GB GDDR6, PCIe 4.0, HDMI 2.1, DisplayPort 1.4a, GPU Tweak II, Componenti di Livello Militare, LHR	592,	Non-Prime	https://www.amazon.it/ASUS-GeForice-DisplayPort-Consigliata-Componenti/dp/B097TCX8QL/ref=sr_1_41?keywords=gpu&qid=1699547722&sr=8-41	4,7 su 5 stelle	171
NISHZHU R43SG 4.0 Notebook M.2 Key M NVMe Scheda grafica esterna GPU Supporto Metallico PCIe 4.0 X4 Adattatore Riser EGPU ITX (30 Cm)	144,	Prime	https://www.amazon.it/NISHZHU-Notebook-Supporto-Metallico-Adattatore/dp/B0CJJ5PG4P/ref=sr_1_42?keywords=gpu&qid=1699547722&sr=8-42	N/A	Disponibilità: solo 4
HIBOER Supporto Scheda Supporto GPU: Supporto Scheda Video Verticale GPU Holder Regolabile con Magnete in Altezza, Supporto Scheda Grafica Realizzato in Alluminio Aerospaziale Anodizzato	7,	Non-Prime	https://www.amazon.it/HIBOER-Supporto-Scheda-GPU-Aerospaziale/dp/B0BHZB27H6/ref=sr_1_43?keywords=gpu&qid=1699547722&sr=8-43	4,6 su 5 stelle	134
Uyubao Supporto Scheda Grafica GPU, Supporto Scheda Video, Supporto GPU, M(50mm-80mm)	7,	Non-Prime	https://www.amazon.it/Uyubao-Supporto-Scheda-Grafica-50mm-80mm/dp/B0CBTZVR3Y/ref=sr_1_44?keywords=gpu&qid=1699547722&sr=8-44	4,6 su 5 stelle	128
Cooler Master MasterAccessory Supporto GPU ARGB - Previene il Cedimento della Scheda Grafica, Vetro Temperato con Illuminazione Laterale ARGB, Design Versatile, Base Magnetica, Installazione Facile	36,	Prime	https://www.amazon.it/Cooler-Master-MasterAccessory-Supporto-ARGB/dp/B09831RG1S/ref=sr_1_45?keywords=gpu&qid=1699547722&sr=8-45	4,3 su 5 stelle	2.074
LINKUP - AVA5 Cavo Riser PCIE 5.0┃Pronto Futuro per Supporto GPU Verticale Gen 5┃Velocità x16 128GB/s con Ritiming del Link e Correzione Errori di Potenza┃PCIE 4.0 Compatibile┃Angolo Retto, Nero 10cm	89,	Prime	https://www.amazon.it/LINKUP-5-0%E2%94%83Pronto-5%E2%94%83Velocit%C3%A0-Potenza%E2%94%83PCIE-Compatibile%E2%94%83Angolo/dp/B0CC44BR1R/ref=sr_1_46?keywords=gpu&qid=1699547722&sr=8-46	4,5 su 5 stelle	2.003
QEEROYO Pad Termico, Thermal Pad, 30 Pezzi Pad Termico in Silicone, Thermal Pad in Silicone Blu, Thermal Pad Riutilizzabile, Termico in Silicone, per CPU GPU Dissipatore di Calore, 0,5/1/ 1,5 mm	7,	Non-Prime	https://www.amazon.it/QEEROYO-Termico-Silicone-Riutilizzabile-Dissipatore/dp/B0CJR8DD9D/ref=sr_1_47?keywords=gpu&qid=1699547722&sr=8-47	N/A	N/A
chenyang Cavo modulare da 12 pin a ATX Dual 8 pin e 6 pin splitter GPU scheda grafica per 3080 3090 AX850 AX750 AX650	7,	Non-Prime	https://www.amazon.it/chenyang-modulare-splitter-scheda-grafica/dp/B08PFHVZTS/ref=sr_1_48?keywords=gpu&qid=1699547722&sr=8-48	4,4 su 5 stelle	99
ASUS Dual Nvidia GeForce RTX 2060 6GB EVO Gaming Scheda Grafica, 6GB GDDR6 192-bit PCIE 4.0, GPU NVIDIA Ampere	307,	Prime	https://www.amazon.it/ASUS-Nvidia-GeForce-Grafica-192-bit/dp/B07V32M9SQ/ref=sr_1_49?keywords=gpu&qid=1699547722&sr=8-49	4,6 su 5 stelle	306
EZDIY-FAB Staffa di Supporto per GPU, Supporto per Scheda Grafica ARGB 5V 3PIN, Supporto per GPU Regolabile in Altezza, Supporto per Scheda Video in Alluminio - Bianco	17,	Non-Prime	https://www.amazon.it/EZDIY-FAB-Supporto-Grafica-Regolabile-Alluminio/dp/B0C7GC6JTN/ref=sr_1_50?keywords=gpu&qid=1699547722&sr=8-50	4,5 su 5 stelle	122
Scheda Video MAXSUN AMD Radeon RX 550 Basso Profilo 4GB GDDR5 sff Computer PC Gaming Video Scheda grafica GPU 128-Bit DirectX 12 PCI Express X16 3.0, HDMI, DisplayPort	129,	Prime	https://www.amazon.it/RX-550-Profilo-Computer-DisplayPort/dp/B09SKZSDRT/ref=sr_1_51?keywords=gpu&qid=1699547722&sr=8-51	4,2 su 5 stelle	149
EVGA TARJETA GRAFICA 6GB GDDR6 GEFORCE RTX 2060 KO ULTRA GAMING 06G-P4-2068-KR	270,	Prime	https://www.amazon.it/EVGA-TARJETA-GRAFICA-GEFORCE-06G-P4-2068-KR/dp/B083JX52VG/ref=sr_1_52?keywords=gpu&qid=1699547722&sr=8-52	4,5 su 5 stelle	1.047
GIGABYTE VGA AMD RX 6600 EAGLE 8G	229,	Non-Prime	https://www.amazon.it/GIGABYTE-VGA-AMD-6600-EAGLE/dp/B09JCKJ2G9/ref=sr_1_53?keywords=gpu&qid=1699547722&sr=8-53	4,4 su 5 stelle	330
PELADN AMD Radeon RX 580 8 GB, Scheda grafica gaming per giochi e mining di criptovaluta, 30 mh/s, 3 porte DP, 1 porta HDMI, GDDR5, Bus 256 bit, GPU Ellesmere, basso consumo 130 W (Gaming)	148,	Prime	https://www.amazon.it/Grafica-Multimediali-Editing-Ellesmere-consumo/dp/B0B1QTMN6G/ref=sr_1_54?keywords=gpu&qid=1699547722&sr=8-54	4,1 su 5 stelle	98
Uyubao Supporto Scheda Video, Supporto Scheda Grafica GPU, Supporto GPU, Alluminio aerospaziale anodizzato, S(30mm-60mm)	8,	Non-Prime	https://www.amazon.it/Uyubao-Alluminio-aerospaziale-anodizzato-30mm-60mm/dp/B0BY4M4YWS/ref=sr_1_55?keywords=gpu&qid=1699547722&sr=8-55	4,6 su 5 stelle	397
Newwyt GPU RAM Rame nichelato Dissipatore di Calore Scheda Grafica Memoria Miner 3060ti 3070ti Giù Pad Termico GPU 15-40 Gradi Rame	17,	Non-Prime	https://www.amazon.it/nichelato-Dissipatore-Grafica-Memoria-Termico/dp/B0C3PYGBXL/ref=sr_1_56?keywords=gpu&qid=1699547722&sr=8-56	N/A	N/A
Dasing Scheda grafica da termica per RTX 3060 3080 3090, scheda grafica di memoria ausiliaria, 90 x 180 mm (4 m)	39,	Prime	https://www.amazon.it/sspa/click?ie=UTF8&spc=MTozNzQ2Nzc0NzI0Mzc0Njc3OjE2OTk1NDc3MjI6c3BfYnRmOjIwMTQxMDEwNDEyNzk4OjowOjo&url=%2FDasing-3060-3080-3090-raffreddamento%2Fdp%2FB09LS99471%2Fref%3Dsr_1_57_sspa%3Fkeywords%3Dgpu%26qid%3D1699547722%26sr%3D8-57-spons%26sp_csd%3Dd2lkZ2V0TmFtZT1zcF9idGY%26psc%3D1	4,2 su 5 stelle	7
CY Dual ATX 8Pin Femmina a 6+8pin Maschio 180 Gradi Adattatore Angolo per Scheda Grafica GPU	8,	Non-Prime	https://www.amazon.it/sspa/click?ie=UTF8&spc=MTozNzQ2Nzc0NzI0Mzc0Njc3OjE2OTk1NDc3MjI6c3BfYnRmOjMwMDAzMjk1MTE0OTUzMjo6MDo6&url=%2FFemmina-Maschio-Adattatore-Angolo-Grafica%2Fdp%2FB08NTBZZ1Q%2Fref%3Dsr_1_58_sspa%3Fkeywords%3Dgpu%26qid%3D1699547722%26sr%3D8-58-spons%26sp_csd%3Dd2lkZ2V0TmFtZT1zcF9idGY%26psc%3D1	4,4 su 5 stelle	8
Scheda Grafica RX 580, Scheda Grafica da Gioco GDDR5 da 8 GB a 256 Bit, PCI Express 3.0x16, 3 DisplayPort HDMI DVI, Schede Video per PC con Doppio Raffreddamento Ad Aria, Supporto per Display 4K	179,	Prime	https://www.amazon.it/sspa/click?ie=UTF8&spc=MTozNzQ2Nzc0NzI0Mzc0Njc3OjE2OTk1NDc3MjI6c3BfYnRmOjIwMTExMTcwNTY2Njk4OjowOjo&url=%2FGrafica-Express-DisplayPort-Raffreddamento-Supporto%2Fdp%2FB0B8YSZ42P%2Fref%3Dsr_1_59_sspa%3Fkeywords%3Dgpu%26qid%3D1699547722%26sr%3D8-59-spons%26sp_csd%3Dd2lkZ2V0TmFtZT1zcF9idGY%26psc%3D1	3,0 su 5 stelle	4
LINKUP - 30cm Cavo di Prolunga PSU Super Morbido e Flessibile con Guaina Personalizzata GPU PC Intrecciata con Kit Pettine┃1x 24 P (20+4)┃2x 8 P (4+4) CPU┃2x 8 P (6+2) GPU set┃300mm - Verde Nero	46,	Prime	https://www.amazon.it/sspa/click?ie=UTF8&spc=MTozNzQ2Nzc0NzI0Mzc0Njc3OjE2OTk1NDc3MjI6c3BfYnRmOjIwMDU2NDU3ODQ2ODA2OjowOjo&url=%2FLINKUP-Flessibile-Personalizzata-Intrecciata-Pettine%25E2%2594%25831x%2Fdp%2FB08HPD3N9V%2Fref%3Dsr_1_60_sspa%3Fkeywords%3Dgpu%26qid%3D1699547722%26sr%3D8-60-spons%26sp_csd%3Dd2lkZ2V0TmFtZT1zcF9idGY%26psc%3D1	4,5 su 5 stelle	7.062
KEDIERS Case PC - PC da gioco ATX Tower in vetro temperato con 9 ventole ARGB，C590，bianco	129,90	Prime	https://www.amazon.it/sspa/click?ie=UTF8&spc=MToxNDQ3MDU5OTE2ODQxNjc3OjE2OTk1NDc3Mjg6c3BfYXRmX25leHQ6MjAxMjQ5Mzg4ODcxOTg6OjA6Og&url=%2FKEDIERS-C590-Premium-Case-Gaming%2Fdp%2FB0B4KJ77PG%2Fref%3Dsr_1_49_sspa%3Fkeywords%3Dgpu%26qid%3D1699547728%26sr%3D8-49-spons%26sp_csd%3Dd2lkZ2V0TmFtZT1zcF9hdGZfbmV4dA%26psc%3D1	3,8 su 5 stelle	443
Kit di Raffreddamento ad Acqua per Computer PC, Set di Raffreddamento a Liquido per CPU all-in-One Fai-da-Te: dissipatore di Calore da 240 mm CPU/GPU Blocco Serbatoio Pompa LED Ventola	185,19	Prime	https://www.amazon.it/sspa/click?ie=UTF8&spc=MToxNDQ3MDU5OTE2ODQxNjc3OjE2OTk1NDc3Mjg6c3BfYXRmX25leHQ6MzAwMDQ5OTEzMzk2ODMyOjowOjo&url=%2FRaffreddamento-Acqua-Computer-Liquido-all%2Fdp%2FB08HVSCM2V%2Fref%3Dsr_1_50_sspa%3Fkeywords%3Dgpu%26qid%3D1699547728%26sr%3D8-50-spons%26sp_csd%3Dd2lkZ2V0TmFtZT1zcF9hdGZfbmV4dA%26psc%3D1	3,6 su 5 stelle	3
Scheda Grafica RX 580, Scheda Grafica GDDR5 da 8 GB con GPU 1284 MHz, 60 Hz 4K, PCI Express 3.0, 2 Ventole di Raffreddamento, Scheda Grafica da Gioco per CAD 3D, CAM, Editing Video e Immagini	120,17	Non-Prime	https://www.amazon.it/sspa/click?ie=UTF8&spc=MToxNDQ3MDU5OTE2ODQxNjc3OjE2OTk1NDc3Mjg6c3BfYXRmX25leHQ6MzAwMDA1NzE3NDg0NDMyOjowOjo&url=%2FGrafica-Express-Ventole-Raffreddamento-Immagini%2Fdp%2FB0BHWXNCH4%2Fref%3Dsr_1_51_sspa%3Fkeywords%3Dgpu%26qid%3D1699547728%26sr%3D8-51-spons%26sp_csd%3Dd2lkZ2V0TmFtZT1zcF9hdGZfbmV4dA%26psc%3D1	3,6 su 5 stelle	42
Feredery RX580 8G AMD Gaming Graphics Card 8GB GDDR5 256BIT 2048SP 1206MHz/1500MHz PCI-E3.0 X16 DP -Interfaccia compatibile	135,97	Non-Prime	https://www.amazon.it/sspa/click?ie=UTF8&spc=MToxNDQ3MDU5OTE2ODQxNjc3OjE2OTk1NDc3Mjg6c3BfYXRmX25leHQ6MzAwMDEzODIxMjAxMjMyOjowOjo&url=%2FFeredery-Graphics-PCI-E3-0-Interfaccia-compatibile%2Fdp%2FB0BSF2GLQK%2Fref%3Dsr_1_52_sspa%3Fkeywords%3Dgpu%26qid%3D1699547728%26sr%3D8-52-spons%26sp_csd%3Dd2lkZ2V0TmFtZT1zcF9hdGZfbmV4dA%26psc%3D1	N/A	N/A
ASUS NVIDIA GeForce GT 730 Scheda Grafica PCIe 2.0, Memoria DDR3 2 GB, Raffreddamento Passivo, Auto-Extreme, GPU Tweak II, Grigio	76,89	Prime	https://www.amazon.it/ASUS-GeForce-Grafica-Raffreddamento-Auto-Extreme/dp/B0BHDVLWJQ/ref=sr_1_53?keywords=gpu&qid=1699547728&sr=8-53	4,6 su 5 stelle	5
ASUS ROG Strix AMD Radeon RX 6650 XT V2 OC Edition Scheda Grafica, 8 GB GDDR6 128-bit 17,5 Gbps PCIE 4.0, GPU Tweak III, ROG-STRIX-RX6650XT-O8G-V2-GAMING	283,14	Non-Prime	https://www.amazon.it/ASUS-Radeon-Grafica-128-bit-ROG-STRIX-RX6650XT-O8G-V2-GAMING/dp/B0BSH7B4LY/ref=sr_1_54?keywords=gpu&qid=1699547728&sr=8-54	4,3 su 5 stelle	154
ASUS TUF Gaming NVIDIA GeForce RTX 4070 OC Edition Scheda Grafica, 12GB GDDR6X 192-bit 21 Gbps PCIE 4.0, GPU NVIDIA Ada Lovelace, TUF-RTX4070-O12G-GAMING	741,19	Non-Prime	https://www.amazon.it/ASUS-GeForce-Grafica-Lovelace-TUF-RTX4070-O12G-GAMING/dp/B0BVMM9VB1/ref=sr_1_55?keywords=gpu&qid=1699547728&sr=8-55	4,5 su 5 stelle	68
LINKUP - AVA5 Cavo Riser PCIE 5.0┃Pronto Futuro per Supporto GPU Verticale Gen 5┃Velocità x16 128GB/s con Ritiming del Link e Correzione Errori di Potenza┃PCIE 4.0 Compatibile┃Angolo Retto, Nero 15cm	88,95	Prime	https://www.amazon.it/sspa/click?ie=UTF8&spc=MToxNDE1OTcxMTM0MTI5Njc3OjE2OTk1NDc3Mjg6c3Bfc2VhcmNoX3RoZW1hdGljOjMwMDA2OTM5OTM5MTgzMjo6MDo6&url=%2FLINKUP-5-0%25E2%2594%2583Pronto-5%25E2%2594%2583Velocit%25C3%25A0-Potenza%25E2%2594%2583PCIE-Compatibile%25E2%2594%2583Angolo%2Fdp%2FB0CC3SZZ7R%2Fref%3Dsxin_17_pa_sp_search_thematic_sspa%3Fcontent-id%3Damzn1.sym.67a3e64a-7fcc-40cb-a348-256ff292c061%253Aamzn1.sym.67a3e64a-7fcc-40cb-a348-256ff292c061%26cv_ct_cx%3Dgpu%26keywords%3Dgpu%26pd_rd_i%3DB0CC3SZZ7R%26pd_rd_r%3Da3df18db-e2b0-4ded-abbb-77175e73a54f%26pd_rd_w%3DfgIsc%26pd_rd_wg%3DeXRMi%26pf_rd_p%3D67a3e64a-7fcc-40cb-a348-256ff292c061%26pf_rd_r%3DZF1Z3JFT71FC2P10M8E8%26qid%3D1699547728%26sbo%3DRZvfv%252F%252FHxDF%252BO5021pAnSA%253D%253D%26sr%3D1-49-b1149505-6a8e-43e6-ad16-2b4f2671e365-spons%26sp_csd%3Dd2lkZ2V0TmFtZT1zcF9zZWFyY2hfdGhlbWF0aWM%26psc%3D1	4,5 su 5 stelle	2.003
upHere GPU Scheda di Supporto LED ARGB Scheda Grafica Scheda Video per Supporto a Sfera/Custodia per Frame, schede Singole o Doppie,G276ARGB	15,99	Non-Prime	https://www.amazon.it/sspa/click?ie=UTF8&spc=MToxNDE1OTcxMTM0MTI5Njc3OjE2OTk1NDc3Mjg6c3Bfc2VhcmNoX3RoZW1hdGljOjIwMTI4MzI1NTk4MTk4OjoxOjo&url=%2FupHere-G276ARGB-Supporto-supporto-grafica%2Fdp%2FB08YYB3WM2%2Fref%3Dsxin_17_pa_sp_search_thematic_sspa%3Fcontent-id%3Damzn1.sym.67a3e64a-7fcc-40cb-a348-256ff292c061%253Aamzn1.sym.67a3e64a-7fcc-40cb-a348-256ff292c061%26cv_ct_cx%3Dgpu%26keywords%3Dgpu%26pd_rd_i%3DB08YYB3WM2%26pd_rd_r%3Da3df18db-e2b0-4ded-abbb-77175e73a54f%26pd_rd_w%3DfgIsc%26pd_rd_wg%3DeXRMi%26pf_rd_p%3D67a3e64a-7fcc-40cb-a348-256ff292c061%26pf_rd_r%3DZF1Z3JFT71FC2P10M8E8%26qid%3D1699547728%26sbo%3DRZvfv%252F%252FHxDF%252BO5021pAnSA%253D%253D%26sr%3D1-50-b1149505-6a8e-43e6-ad16-2b4f2671e365-spons%26sp_csd%3Dd2lkZ2V0TmFtZT1zcF9zZWFyY2hfdGhlbWF0aWM%26psc%3D1	4,2 su 5 stelle	892
